{"$schema":"https://json-schema.org/draft/2020-12/schema","$id":"https://aureoninstitute.com/schemas/agpha.input-bundle.v1.schema.json","title":"AGPHA frozen acquisition input bundle v1","type":"object","additionalProperties":false,"required":["schema_version","taxon_key","taxon"],"properties":{"schema_version":{"const":"agpha.input-bundle.v1"},"taxon_key":{"type":"string","minLength":1},"shard_id":{"type":"string","minLength":1},"taxon":{"$ref":"#/$defs/taxon"},"claim_ceiling":{"enum":["inventory_only","material_authentication","preclinical_hypothesis"]},"boundary_statement":{"type":"string","minLength":1},"evidence":{"type":"array","items":{"$ref":"#/$defs/evidence"}},"proteins":{"type":"array","items":{"$ref":"#/$defs/proteinInput"}},"molecules":{"type":"array","items":{"$ref":"#/$defs/molecule"}},"spectral_peaks":{"type":"array","items":{"$ref":"#/$defs/spectralPeak"}},"observations":{"type":"array","items":{"$ref":"#/$defs/observation"}},"gaps":{"type":"array","items":{"$ref":"#/$defs/gap"}},"metadata":{"type":"object"}},"$defs":{"sha256":{"type":"string","pattern":"^[0-9a-fA-F]{64}$"},"nullableString":{"type":["string","null"]},"evidence":{"type":"object","additionalProperties":false,"required":["provider","record_id","state","source_uri","licence","retrieved_at","checksum_sha256","notes"],"properties":{"provider":{"type":"string","minLength":1},"record_id":{"type":"string","minLength":1},"state":{"enum":["measured_direct","curated_direct","computed","inferred_ortholog","negative_result","no_data","query_not_run","conflicting"]},"source_uri":{"$ref":"#/$defs/nullableString"},"licence":{"$ref":"#/$defs/nullableString"},"retrieved_at":{"$ref":"#/$defs/nullableString"},"checksum_sha256":{"anyOf":[{"$ref":"#/$defs/sha256"},{"type":"null"}]},"notes":{"$ref":"#/$defs/nullableString"}}},"taxon":{"type":"object","additionalProperties":false,"required":["accepted_name","rank","family","genus","identifiers","synonyms"],"properties":{"accepted_name":{"type":"string","minLength":3},"rank":{"const":"species"},"family":{"$ref":"#/$defs/nullableString"},"genus":{"$ref":"#/$defs/nullableString"},"identifiers":{"type":"object","additionalProperties":{"type":"string","minLength":1}},"synonyms":{"type":"array","items":{"type":"string","minLength":1},"uniqueItems":true}}},"molecule":{"type":"object","additionalProperties":false,"required":["molecule_id","name","identifiers","evidence","plant_parts","phases","notes"],"properties":{"molecule_id":{"type":"string","minLength":1},"name":{"type":"string","minLength":1},"identifiers":{"type":"object","additionalProperties":{"type":"string","minLength":1}},"evidence":{"type":"array","minItems":1,"items":{"$ref":"#/$defs/evidence"}},"plant_parts":{"type":"array","items":{"type":"string","minLength":1},"uniqueItems":true},"phases":{"type":"array","items":{"type":"string","minLength":1},"uniqueItems":true},"notes":{"$ref":"#/$defs/nullableString"}}},"spectralPeak":{"type":"object","additionalProperties":false,"required":["peak_id","subject_id","value","unit","method","evidence","relative_intensity","assignment","phase"],"properties":{"peak_id":{"type":"string","minLength":1},"subject_id":{"type":"string","minLength":1},"value":{"type":"number","exclusiveMinimum":0},"unit":{"enum":["cm^-1","nm","Hz","THz"]},"method":{"type":"string","minLength":1},"evidence":{"$ref":"#/$defs/evidence"},"relative_intensity":{"type":["number","string","null"]},"assignment":{"$ref":"#/$defs/nullableString"},"phase":{"$ref":"#/$defs/nullableString"}}},"observation":{"type":"object","additionalProperties":false,"required":["observation_id","statement","evidence_state","evidence","interpretation_boundary"],"properties":{"observation_id":{"type":"string","minLength":1},"statement":{"type":"string","minLength":1},"evidence_state":{"enum":["measured_direct","curated_direct","computed","inferred_ortholog","negative_result","no_data","query_not_run","conflicting"]},"evidence":{"type":"array","minItems":1,"items":{"$ref":"#/$defs/evidence"}},"interpretation_boundary":{"type":"string","minLength":1}}},"gap":{"type":"object","additionalProperties":false,"required":["gap_id","layer","state","query_scope","reason","next_action"],"properties":{"gap_id":{"type":"string","minLength":1},"layer":{"type":"string","minLength":1},"state":{"enum":["negative_result","no_data","query_not_run","conflicting"]},"query_scope":{"type":"string","minLength":1},"reason":{"type":"string","minLength":1},"next_action":{"$ref":"#/$defs/nullableString"}}},"proteinInput":{"type":"object","additionalProperties":false,"required":["protein_id","evidence"],"properties":{"protein_id":{"type":"string","minLength":1},"accession":{"$ref":"#/$defs/nullableString"},"name":{"$ref":"#/$defs/nullableString"},"sequence":{"type":"string","minLength":7},"sequence_sha256":{"anyOf":[{"$ref":"#/$defs/sha256"},{"type":"null"}]},"sequence_length":{"type":["integer","null"],"minimum":1},"evidence":{"type":"array","minItems":1,"items":{"$ref":"#/$defs/evidence"}},"gene":{"$ref":"#/$defs/nullableString"},"reviewed":{"type":["boolean","null"]},"structure_ids":{"type":"array","items":{"type":"string","minLength":1},"uniqueItems":true},"notes":{"$ref":"#/$defs/nullableString"}}}}}
